text,name,id,lang,translated
"Officiellt: Han blir ny tränare i GIF Sundsvall
https://t.co/dz2RpECJ19
#superettan https://t.co/qbpWz4Ldiw",ftransfers,95957695,sv,Official: He becomes new coach in GIF Sundsvall https://t.co/dz2RpECJ19 #superettan https://t.co/qbpWz4Ldiw
"Officiellt: Landskrona BoIS förlänger med målvakt
https://t.co/drcnKygH9g
#ettanfotboll https://t.co/hQoFTZYT7E",ftransfers,95957695,sv,Official: Landskrona BoIS extends with goalkeeper https://t.co/drcnKygH9g #ettanfotboll https://t.co/hQoFTZYT7E
"Fletcher: ""Han vill uppenbarligen inte vara i Tottenham""
https://t.co/feSPXfLPl2 https://t.co/XM8h7uwEYk",ftransfers,95957695,sv,Fletcher: &quot;He obviously doesn&#39;t want to be in Tottenham&quot; https://t.co/feSPXfLPl2 https://t.co/XM8h7uwEYk
"Officiellt: Lagkaptenen förlänger med Umeå FC
https://t.co/IUz2Bx3lEz
#superettan https://t.co/quDIct9aHz",ftransfers,95957695,sv,Official: Team captain extends with Umeå FC https://t.co/IUz2Bx3lEz #superettan https://t.co/quDIct9aHz
"Dembl kopplas ihop med italiensk storklubb
https://t.co/XTgZCEsUk1 https://t.co/KcOYJL6fHg",ftransfers,95957695,da,Dembl is paired with Italian big club https://t.co/XTgZCEsUk1 https://t.co/KcOYJL6fHg
"Officiellt: AFC Eskilstuna kontrakterar talang
https://t.co/VxkrStruI4
#superettan https://t.co/foniD1tfjL",ftransfers,95957695,da,Official: AFC Eskilstuna contracts talent https://t.co/VxkrStruI4 #superettan https://t.co/foniD1tfjL
"Sportchefen: ""Storklubbar vill ha Minamino - jag hade inte tvekat på att värva honom""
https://t.co/tPDyYP7JjV https://t.co/ltcp6jIeoW",ftransfers,95957695,sv,Sports Manager: &quot;Big clubs want Minamino - I had no hesitation in recruiting him&quot; https://t.co/tPDyYP7JjV https://t.co/ltcp6jIeoW
"Willian: ""Min agent förhandlar med dem""
https://t.co/tClmq0H04R https://t.co/IZr73WcU0u",ftransfers,95957695,sv,Willian: &quot;My agent negotiates with them&quot; https://t.co/tClmq0H04R https://t.co/IZr73WcU0u
"Neymar: ""r jag lycklig i Paris? Jag är...""
https://t.co/zjpLtJYL7Y https://t.co/blo02cuv3q",ftransfers,95957695,sv,Neymar: &quot;Am I Happy in Paris? I&#39;m ...&quot; https://t.co/zjpLtJYL7Y https://t.co/blo02cuv3q
"Jagas av storklubbar - hyllas av Guardiola: ""r en toppspelare""
https://t.co/KpjgExvNSh https://t.co/4es27yXwBf",ftransfers,95957695,sv,Hunted by major clubs - acclaimed by Guardiola: &quot;is a top player&quot; https://t.co/KpjgExvNSh https://t.co/4es27yXwBf
"Tottenham kan sälja mittfältaren i januari
https://t.co/dD5wmPNSrQ https://t.co/7AtQvpV5b4",ftransfers,95957695,sv,Tottenham can sell midfielder in January https://t.co/dD5wmPNSrQ https://t.co/7AtQvpV5b4
"Officiellt: Ljungskile SK förlänger med nyckelspelare
https://t.co/LkPvdp6o8y
#superettan https://t.co/EVCdGTKbGd",ftransfers,95957695,sv,Official: Ljungskile SK extends with key player https://t.co/LkPvdp6o8y #superettan https://t.co/EVCdGTKbGd
"Rasmus Jönsson kan bryta kontraktet och återvända till Allsvenskan
https://t.co/euM7B2Ttgh
#allsvenskan https://t.co/VsHRZ6xzsw",ftransfers,95957695,sv,Rasmus Jönsson can cancel the contract and return to Allsvenskan https://t.co/euM7B2Ttgh #allsvenskan https://t.co/VsHRZ6xzsw
"Uppgifter: Unai Emery öppen för PL-klubben, men...
https://t.co/tz1C7EnltA https://t.co/76O0Km39jX",ftransfers,95957695,sv,"Tasks: Unai Emery open to PL club, but ... https://t.co/tz1C7EnltA https://t.co/76O0Km39jX"
"Fem klubbar kan göra upp om Todibo
https://t.co/MyZIqSr9we https://t.co/clgWkc854w",ftransfers,95957695,sv,Five clubs can settle on Todibo https://t.co/MyZIqSr9we https://t.co/clgWkc854w
"Berge om toppklubben: ""Det var trevligt att spela där""
https://t.co/hmMIi5AFs4 https://t.co/UM8zHnupbh",ftransfers,95957695,sv,Berge on the top club: &quot;It was nice to play there&quot; https://t.co/hmMIi5AFs4 https://t.co/UM8zHnupbh
"Uppgifter: Så löser GIF Sundsvall tränarfrågan
https://t.co/ZMygAq8zdZ
#superettan https://t.co/DjYLHjbiRl",ftransfers,95957695,sv,Tasks: How GIF Solves Sundsvall Trainer Question https://t.co/ZMygAq8zdZ #superettan https://t.co/DjYLHjbiRl
"Engelsk storklubb kan värva Takumi Minamino
https://t.co/IJ0YwbiuZH https://t.co/zxYUJBUS5P",ftransfers,95957695,sv,English major club can recruit Takumi Minamino https://t.co/IJ0YwbiuZH https://t.co/zxYUJBUS5P
"""Som det känns just nu blir det ingen återkomst i FK""
https://t.co/QCdVbfNVdw
#allsvenskan https://t.co/spGdKQjdMB",ftransfers,95957695,sv,&quot;As it feels right now there will be no return in FK&quot; https://t.co/QCdVbfNVdw #allsvenskan https://t.co/spGdKQjdMB
"GIF Sundsvall vill värva mittfältaren: ""Alltid välkommen""
https://t.co/Tx2xrADDid
#superettan https://t.co/ZmuEE1ZmVT",ftransfers,95957695,sv,GIF Sundsvall wants to recruit the midfielder: &quot;Always welcome&quot; https://t.co/Tx2xrADDid #superettan https://t.co/ZmuEE1ZmVT
"""Om de kan värva Messi är det fantastiskt - men annars...""
https://t.co/rwLx9uCAtu https://t.co/lwBwKfeLUR",ftransfers,95957695,sv,"&quot;If they can recruit Messi, it&#39;s great - but otherwise ...&quot; https://t.co/rwLx9uCAtu https://t.co/lwBwKfeLUR"
"Gennaro Gattuso kan värva från Milan
https://t.co/mdwfSzsfcv https://t.co/u4CYsTLA5h",ftransfers,95957695,sv,Gennaro Gattuso can refer from Milan https://t.co/mdwfSzsfcv https://t.co/u4CYsTLA5h
"De uppges visa starkast intresse för Kai Havertz
https://t.co/MdpFPdpF4U https://t.co/ZxAEOLMIUc",ftransfers,95957695,sv,They are reported to show strongest interest in Kai Havertz https://t.co/MdpFPdpF4U https://t.co/ZxAEOLMIUc
"Uppgifter: r överens om Kulusevski - för 367 miljoner
https://t.co/tRjiyIjpap https://t.co/bTmjwthd3s",ftransfers,95957695,sv,Details: agree on Kulusevski - for 367 million https://t.co/tRjiyIjpap https://t.co/bTmjwthd3s
"Officiellt: Jens T Andersson lämnar AIK
https://t.co/pUFzO5NN6o
#allsvenskan #aik https://t.co/AuaCrZ77FM",ftransfers,95957695,sv,Official: Jens T Andersson leaves AIK https://t.co/pUFzO5NN6o #allsvenskan #aik https://t.co/AuaCrZ77FM
"Håland uppges ha landat - för förhandlingar med storklubben
https://t.co/lmBsgDMpvs https://t.co/ag2VWqGQtm",ftransfers,95957695,sv,Håland is reported to have landed - for negotiations with the big club https://t.co/lmBsgDMpvs https://t.co/ag2VWqGQtm
"Kostade närmare 800 miljoner - lämnar Atletico Madrid i januari?
https://t.co/wggJdARmZV https://t.co/B2kH4vtAwz",ftransfers,95957695,sv,Cost nearly 800 million - will leave Atletico Madrid in January? https://t.co/wggJdARmZV https://t.co/B2kH4vtAwz
"Han uppges kunna bli tränare i Kalmar FF
https://t.co/axKgtfiqwf
#allsvenskan https://t.co/Ls7C593R5j",ftransfers,95957695,sv,He is reported to be a coach in Kalmar FF https://t.co/axKgtfiqwf #allsvenskan https://t.co/Ls7C593R5j
"Malmö FF uppges jaga landslagsanfallare
https://t.co/EF1Qfzv4Sp
#allsvenskan #mff https://t.co/Ruwdt4dLt5",ftransfers,95957695,sv,Malmö FF reportedly chasing national team striker https://t.co/EF1Qfzv4Sp #allsvenskan #mff https://t.co/Ruwdt4dLt5
"Gattuso om Ibrahimovic: ""Jag vill prata om...""
https://t.co/xcmYf1FYpc https://t.co/JOcx4q6XNp",ftransfers,95957695,sv,Gattuso about Ibrahimovic: &quot;I want to talk about ...&quot; https://t.co/xcmYf1FYpc https://t.co/JOcx4q6XNp
"Uwe Rösler uppges lämna - köps ut av Malmö FF
https://t.co/Cg5ZoH8oSD
#allsvenskan #mff https://t.co/D4KKRRJPpA",ftransfers,95957695,sv,Uwe Rösler is reportedly leaving - purchased by Malmö FF https://t.co/Cg5ZoH8oSD #allsvenskan #mff https://t.co/D4KKRRJPpA
"Officiellt: Falkenbergs FF förlänger med försvarare
https://t.co/zfazqYWJsq
#allsvenskan https://t.co/YQYuGKUE8v",ftransfers,95957695,sv,Official: Falkenbergs FF extends with defender https://t.co/zfazqYWJsq #allsvenskan https://t.co/YQYuGKUE8v
"Uppgifter: Arsenal har erbjudit tränaren ett kontraktsförslag
https://t.co/J7hD1FYsKb https://t.co/fwkMWk2WIP",ftransfers,95957695,sv,Tasks: Arsenal has offered the coach a contract proposal https://t.co/J7hD1FYsKb https://t.co/fwkMWk2WIP
"Albin Gashi uppges vara nära Superettanklubb
https://t.co/yeqrSJjtGS
#superettan https://t.co/DnlbRkDV79",ftransfers,95957695,sv,Albin Gashi is reported to be near the Superettan Club https://t.co/yeqrSJjtGS #superettan https://t.co/DnlbRkDV79
"Officiellt: Christian Rubio Sivodedov förlänger kontraktet
https://t.co/IleJVDgXvX
#superettan https://t.co/t75zlXncQF",ftransfers,95957695,sv,Official: Christian Rubio Sivodedov extends contract https://t.co/IleJVDgXvX #superettan https://t.co/t75zlXncQF
"Officiellt: Gennaro Gattuso tar över Napoli
https://t.co/g7n0my72vJ https://t.co/zMuB6Vsfcp",ftransfers,95957695,sv,Official: Gennaro Gattuso takes over Naples https://t.co/g7n0my72vJ https://t.co/zMuB6Vsfcp
"MFF:s rival bekräftar: ""Försökte värva Markus Rosenberg""
https://t.co/QGU1YeMIN0
#allsvenskan #mff https://t.co/I1igWtESgu",ftransfers,95957695,sv,MFF&#39;s rival confirms: &quot;Tried to recruit Markus Rosenberg&quot; https://t.co/QGU1YeMIN0 #allsvenskan #mff https://t.co/I1igWtESgu
"Storklubben trappar upp jakten på Wilfried Zaha
https://t.co/uqLYiJSAFV https://t.co/5iBiDumzeR",ftransfers,95957695,sv,The big club steps up the hunt for Wilfried Zaha https://t.co/uqLYiJSAFV https://t.co/5iBiDumzeR
"Officiellt: Placerats i storklubbar - förlänger nu kontraktet
https://t.co/9riEMzLe3T https://t.co/tDYXPHXSpm",ftransfers,95957695,sv,Official: Placed in major clubs - now extends contract https://t.co/9riEMzLe3T https://t.co/tDYXPHXSpm
"Officiellt: Nahom Girmai Netabay klar för IK Sirius
https://t.co/Z5NjUacjIQ
#allsvenskan https://t.co/F5omxGi3J0",ftransfers,95957695,no,Official: Nahom Girmai Netabay ready for IK Sirius https://t.co/Z5NjUacjIQ #allsvenskan https://t.co/F5omxGi3J0
"Jagas av storklubbar: ""r bortom vår kontroll""
https://t.co/VkbnI1hDfy https://t.co/MSQQsW0Arp",ftransfers,95957695,sv,Chased by big clubs: &quot;beyond our control&quot; https://t.co/VkbnI1hDfy https://t.co/MSQQsW0Arp
"Officiellt: Back förlänger med Varbergs BoIS
https://t.co/Lwx3mbWT3L
#allsvenskan https://t.co/maEwXsPtct",ftransfers,95957695,sv,Official: Back extends with Varberg&#39;s BoIS https://t.co/Lwx3mbWT3L #allsvenskan https://t.co/maEwXsPtct
@off_gbg Dkrev lite med en nöffnöffare inför 2019. Skrev ju inget om landslaget men.. https://t.co/rGaHyqSlde,19bebben04,3410798469,sv,@off_gbg Drew a little with a knockout for 2019. Didn&#39;t write anything about the national team but .. https://t.co/rGaHyqSlde
Då fick man anledning att följa Januariturnen. Kul för samtliga men känner lite extra för DaGraca som ändå fått ta https://t.co/aegsZ1Lu5Y,19bebben04,3410798469,sv,Then you had to follow the January tour. Fun for all but feel a little extra for DaGraca who still had to take https://t.co/aegsZ1Lu5Y
RT @EricSjolin: Brndby testar legal pyroteknik i form av så kallade kalla pjäser. Spännande att se hur det här tas emot och utvecklas! h,19bebben04,3410798469,sv,RT @EricSjolin: Brndby tests legal pyrotechnics in the form of so-called cold plays. Exciting to see how this is received and developed! hrs
Mer Allsvensk silly o mindre Zlatan tack. #ifkgbg #media #allsvenskan,19bebben04,3410798469,sv,More Allsvensk silly and less Zlatan thanks. #ifkgbg #media #allsvenskan
"Blåvitts ordförande summerar Zlatans delägarskap enligt följande:

 Jag tror inte att det här är bra för något var https://t.co/L4Zeoz2EmN",19bebben04,3410798469,sv,Blue White&#39;s President sums up Zlatan&#39;s co-ownership as follows: I don&#39;t think this is good for anything was https://t.co/L4Zeoz2EmN
"29/11 Statyn står kvar.
Stackars Alfons berg! #zlatangate #zlatan https://t.co/WRCYxfaC5t",19bebben04,3410798469,sv,29/11 The statue remains. Poor Alfons mountain! #zlatangate #zlatan https://t.co/WRCYxfaC5t
Malmö drömmer om att få möta ett  Europeiskt storlag. IFK var ett Europeiskt storlag. Den skillnaden kan vara bra a https://t.co/Mq108g6ItB,19bebben04,3410798469,sv,Malmö dreams of meeting a European big team. IFK was a European big team. That difference can be good a https://t.co/Mq108g6ItB
Fortfarande helt tagen av #zlatangate mff vs Zlatan = hybris vs hybris. Så underhållande att se när de drar ner byx https://t.co/pTxjcTuDqs,19bebben04,3410798469,sv,Still completely taken by #zlatangate mff vs Zlatan = hybris vs hybris. So entertaining to watch as they pull down pants https://t.co/pTxjcTuDqs
@JALV82BAGE @GrundenBois Att gå från Grunden till mff är ju lite som att gå från Barcelona till GAIS. Kommer aldrig hända.,19bebben04,3410798469,sv,@ JALV82BAGE @GrundenBois Going from the Foundation to mff is a bit like going from Barcelona to GAIS. Will never happen.
Kärlek kan komma plötsligt #bajen #mff #ifkgbg https://t.co/cmXBVOtpnH,19bebben04,3410798469,sv,Love can come suddenly #bajen #mff #ifkgbg https://t.co/cmXBVOtpnH
Mmuuuhahahhaaaahhaahhaa. KARMA. #ifkgbg stersund nekas elitlicens för spel i allsvenskan https://t.co/a8R0uc0Jip,19bebben04,3410798469,sv,Mmuuuhahahhaaaahhaahhaa. KARMA. #ifkgbg stersund denied elite license for games in allsvenskan https://t.co/a8R0uc0Jip
RT @VisstJomen: @socialdemokrat Ni borde fundera på om de går att frigöra poliser från den jakt som nu bedrivs mot fotbollssupportrar enlig,19bebben04,3410798469,sv,RT @VisstJomen: @socialdemocrat You should consider whether they can release police from the hunt now conducted against football supporters alone
"@MarkusWulcan Bättre om IFK slår igen de dörrarna nu, Dessa spelare har tjänat miljoner på att låtsas vilja hem var https://t.co/BCcx5VzPI2",19bebben04,3410798469,sv,"@MarkusWulcan Better if IFK closes the doors now, These players have made millions pretending to be home was https://t.co/BCcx5VzPI2"
Anledningarna till att man låtsas vilja hem är för att få bättre förhandlingsläge. Kan även vara bra om man skulle https://t.co/dIYXyMvOz5,19bebben04,3410798469,sv,The reasons why you want to pretend to be home is to get a better negotiating position. Can also be good if you would https://t.co/dIYXyMvOz5
https://t.co/cI8nY0w4S6,19bebben04,3410798469,und,https://t.co/cI8nY0w4S6
https://t.co/2e0dHzyrRC,19bebben04,3410798469,und,https://t.co/2e0dHzyrRC
"I sitt lyckades han tacka IFK, skicka en känga till förbundet och hylla gud  kolla kommentarer för klipp https://t.co/gGk1uqAhNV",19bebben04,3410798469,sv,"In his, he managed to thank IFK, send a boot to the union and pay tribute to God check comments for clips https://t.co/gGk1uqAhNV"
Grattis Gurra!! Fira kungligt och kom sedan hem #ifkgbg,19bebben04,3410798469,sv,Congratulations Gurra !! Celebrate royal and then come home #ifkgbg
Poya #ifkgbg,19bebben04,3410798469,es,Poya #ifkgbg
Min bror var inget fan av pyro. När han såg detta tifo förändrades dock han syn på pyroteknik något. Han tyckte det https://t.co/uFVdrFz90r,19bebben04,3410798469,sv,"My brother was not a fan of pyro. When he saw this typhoon, however, his view of pyrotechnics changed slightly. He thought it https://t.co/uFVdrFz90r"
Intressant ändå hur tydligt de blir att vi gör så få mål från distans. Skickligt att i så hög grad kunna spela sig https://t.co/UwfqSdFOIq,19bebben04,3410798469,sv,Interesting yet how clear they are that we make so few goals from a distance. Skilled in being able to play so much https://t.co/UwfqSdFOIq
@GAnestis 2020 will be great. Stay and be a part of it.,19bebben04,3410798469,en,
2019 övergick tålamod till hopp och tro. Stort tack till alla på KG för väl genomfört arbete. #ifkgbg,19bebben04,3410798469,sv,"In 2019, patience turned to hope and faith. Big thanks to everyone at KG for well done work. #ifkgbg"
"7e plats. Det är vad som kommer stå i böckerna, inte mycket och skryta om. Men 2019 är så mycket mer. IFK får inte https://t.co/2fmo7giTV0",19bebben04,3410798469,sv,"7th place. That&#39;s what&#39;s going to be in the books, not much to brag about. But 2019 is so much more. IFK does not receive https://t.co/2fmo7giTV0"
"RT @Anglarna1973: Det är inte upp till IFK
Det är inte upp till nglarna

Det är upp till DIG att dela med dig till vänner och bekanta att",19bebben04,3410798469,sv,RT @ Anglarna1973: It&#39;s not up to IFK It&#39;s not up to the angels It&#39;s up to YOU to share with friends and acquaintances that
@matsdeland @ErikGerden @RobbieLauler Senast jag kollade så fördelade staten ut pengar till Sveriges Kommun. Det ja https://t.co/exu6Z3eeYE,19bebben04,3410798469,sv,"@matsdeland @ErikGerden @RobbieLauler The last time I checked, the state distributed money to the municipality of Sweden. It yes https://t.co/exu6Z3eeYE"
"@matsdeland @ErikGerden @RobbieLauler Sedan tillkommer momsintäkter, inkomstskatt från alla som har ett jobb tack v https://t.co/SufskFZFyg",19bebben04,3410798469,sv,"@matsdeland @ErikGerden @RobbieLauler Then comes VAT revenue, income tax from everyone who has a job thanks to https://t.co/SufskFZFyg"
@RobbieLauler Tänk att nu står vi på samma planhalva @RobbieLauler Allsvenskans absolut största värde är äktheten. https://t.co/OP9Tq4Xxzo,19bebben04,3410798469,sv,@RobbieLauler Think that we are now on the same floor half @RobbieLauler Allsvenskan&#39;s absolute greatest value is authenticity. https://t.co/OP9Tq4Xxzo
"RT @RobbieLauler: Låt aldrig 2019 upprepas.

Det får inte hända en gång till att allsvenskan består av tio konstgräslag och sex gräslag.

N",19bebben04,3410798469,sv,RT @RobbieLauler: Never repeat 2019. It must not happen once again that all Swedes consist of ten artificial grass species and six grass species. N
Du kom när vi behövde dig som mest. För de kommer du alltid vara älskad. Tack för allt Lasse. #ifkgbg,19bebben04,3410798469,sv,You came when we needed you most. For them you will always be loved. Thanks for everything Lasse. #ifkgbg
Idag säger vi Grattis till  @Glenn_Hysen 60år idag och nygift. Jag antar att du känner dig som en fågel #ifkgbg https://t.co/IxSXDyOoCZ,19bebben04,3410798469,sv,Today we say congratulations to @Glenn_Hysen 60 years today and newlyweds. I guess you feel like a bird #ifkgbg https://t.co/IxSXDyOoCZ
"Gillar tanken på att utveckla Holm som central anfallare. Enligt mig har han bra storlek, tillräcklig speed och en https://t.co/J2bybWdgYO",19bebben04,3410798469,sv,"Like the idea of developing Holm as a central striker. In my opinion he has good size, adequate speed and a https://t.co/J2bybWdgYO"
Ge mig 2020 nu!! #ifkgbg,19bebben04,3410798469,sv,Give me 2020 now !! #ifkgbg
Såg ni Marcus nu era sopor som jämnt gnäller. #ifkgbg,19bebben04,3410798469,sv,Did you see Marcus now your garbage whining evenly. #ifkgbg
Fasthållning och stämpling. Ingenting. #ifkgbg #svmff https://t.co/NpyPZdsbs6,19bebben04,3410798469,sv,Holding and stamping. Nothing. #ifkgbg #svmff https://t.co/NpyPZdsbs6
De pratas om en osannolik guldstrid. Men allt är regisserat av svff. De går inte att tolka årets domarinstser på an https://t.co/ixRSE41XKg,19bebben04,3410798469,sv,They talk about an unlikely gold battle. But everything is directed by svff. They are not able to interpret this year&#39;s judicial review at https://t.co/ixRSE41XKg
Har en jävligt god känsla idag #ifkgbg,19bebben04,3410798469,sv,Have a pretty good feeling today #ifkgbg
Gött skivsläpp idag!! Självklart valde man IFK edition och en slant till blåvitt på den stora dagen. #ifkgbg #joelalme #bortbortbort,19bebben04,3410798469,sv,"Good disc release today !! Of course, they chose IFK edition and a slant to blue and white on the big day. #ifkgbg #joelalme #bortbortbort"
Ingen kanelbulle idag. Idag äter man tårta med 115 ljus. #ifkgbg,19bebben04,3410798469,sv,No cinnamon bun today. Today you eat cake with 115 candles. #ifkgbg
De finns bara ett alternativ.  #teamrudolf #ifkgbg,19bebben04,3410798469,sv,They are just one option. #teamrudolf #ifkgbg
"RT @hysentobias: Okay. Då vet vi!! Sa inget efter straffen, men detta är fan inte ok!!",19bebben04,3410798469,sv,"RT @hysentobias: Okay. Then we know!! Didn&#39;t say anything after the penalty, but this is not ok !!"
Göttänna podden levererar podd med Svennis  #ifkgbg.   https://t.co/sIPahIFVsE,19bebben04,3410798469,sv,The Göttänna podden delivers the pod with Svennis #ifkgbg. https://t.co/sIPahIFVsE
"@DanAhlman AFC , Ryssholm behöver flytta verksamheten för Allsvenskt spel 2020.",19bebben04,3410798469,sv,"@DanAhlman AFC, Ryssholm needs to move operations for Allsvenkt game 2020."
Dålig insats av domaren men inte lika dåligt som vissa av våra spelare. Nu skäms man #ifkgbg,19bebben04,3410798469,sv,Bad performance by the referee but not as bad as some of our players. Now you are ashamed of #ifkgbg
"Lider med Aiesh med tanke på hans form blir det ett tungt avbräck. Skönt att kunna slänga in Vibe dock.
#ifkgbg",19bebben04,3410798469,sv,Suffering with Aiesh given his form will be a heavy break. Nice to be able to throw in the Vibe though. #ifkgbg
@Fotbollsdamp Känns lönt att man bytade SUVen mot elcykel,19bebben04,3410798469,sv,@Footbollsdamp Feels good to change the SUV to electric bicycle
"Vilken jävla dag detta blir. Nu kastas vi rätt in i perioden där Allsvenskan avgörs.
#ifkgbg",19bebben04,3410798469,sv,What a fucking day this is. Now we are thrown right into the period when Allsvenskan is being decided. #ifkgbg
"Hej #svff är de ok att gå ut i media och kalla folk mentalsjuka? ""Det är hemskt, de &lt;br /&gt;är mentalt sjuka..."" https://t.co/JqkZoG5TsZ",19bebben04,3410798469,sv,"Hi #svff are they ok to go out in the media and call people mentally ill? &quot;It&#39;s horrible, they &lt;br /&gt; are mentally ill ...&quot; https://t.co/JqkZoG5TsZ"
@Davveman1988 Blåvitts förändring beror på att flera kloka beslut har tagits. Det är inte på långa vägar en one man show.,19bebben04,3410798469,sv,@ Davveman1988 Blue-white change is due to the fact that several wise decisions have been made. It is not on long roads a one man show.
@Davveman1988 Man skall nog inte förminska den betydelsen men en del som varit kritiska till Poya verkar använda an https://t.co/9QVfaKdhUg,19bebben04,3410798469,sv,@ Davveman1988 One should probably not diminish that significance but some that have been critical of Poya seem to use an https://t.co/9QVfaKdhUg
@BojanNickebo Ok. Följer ju inte ff så noga men då mindes jag hyfsat rätt,mattiastjakt,1280489766,sv,@BojanNickebo Ok. Doesn&#39;t follow ff so closely but then I remembered pretty well
@BojanNickebo Han fick väl aldrig riktigt chansen i ff eller minns jag fel??,mattiastjakt,1280489766,sv,@BojanNickebo He never really got the chance in ff or do I remember wrong ??
@schultz_tilda Blir nog tyvärr bara ett år,mattiastjakt,1280489766,sv,@schultz_tilda Unfortunately will only be a year
Högtidströjan hemkommen. Blir en bra jul. #ifkgbg #guldåret2020 #allsvenskan. https://t.co/aDIHN7ZE7c,mattiastjakt,1280489766,sv,The festive shirt returned. Merry Christmas. #ifkgbg # golden year2020 #allsvenskan. https://t.co/aDIHN7ZE7c
Oj. Köpte en båt. #buster,mattiastjakt,1280489766,sv,Oh. Bought a boat. #buster
Börjar bli drygt att vara sjukskriven,mattiastjakt,1280489766,sv,Begins to be just over sick leave
@jagToll Man sover inte bort sitt liv iallafall ,mattiastjakt,1280489766,sv,@jagToll You don&#39;t lose your life anyway
@jagToll Småbarnslivet är ju underbart på många sätt ,mattiastjakt,1280489766,sv,@jagToll Toddler life is wonderful in many ways
@undergivnalena @ortensmagister Sjuk?,mattiastjakt,1280489766,sv,@undergivnalena @ortensmagister Sick?
@Hulkenmini Går fan inte ha radion på under hela december.,mattiastjakt,1280489766,sv,@Hulkenmini Don&#39;t fucking have the radio on throughout December.
Tycker lika illa om MFF och Rosenberg idag som jag gjorde förra veckan och igår.,mattiastjakt,1280489766,sv,Like MFF and Rosenberg today just as badly as I did last week and yesterday.
@psykmys @STHLMode @peppret Ser jobbigt ut,mattiastjakt,1280489766,sv,@psykmys @STHLMode @peppret Looks great
@jagToll Bittra mffsuportrar gör mig lite gladare.,mattiastjakt,1280489766,sv,@jagToll Bitter mffsuporters makes me a little happier.
Någon som vill köpa båt? #båttillslu #Linder #komochköp #extrapris https://t.co/AtjIpifcbQ,mattiastjakt,1280489766,sv,Anyone want to buy a boat? # boat closure #Linder # komo purchase # extra price https://t.co/AtjIpifcbQ
@Silfver66 Bort med smutsen från svensk idrott,mattiastjakt,1280489766,sv,@ Silfver66 Gone with the dirt from Swedish sports
Då går man i båtbytartankar. r ju fan värre än att byta bil.,mattiastjakt,1280489766,sv,Then you go in boat change tanks. is damn worse than changing a car.
@ecmarklund Lyx ,mattiastjakt,1280489766,und,@ecmarklund Luxury
@Nattackera Jag var ju allvarlig. Tycker du är en tuff tjej som fixat jvligt mycket som väldigt många inte fixar. O https://t.co/gI0rOI9hfY,mattiastjakt,1280489766,sv,@Nattacking I was serious after all. Do you think you are a tough girl who fixes a great deal that very many do not fix. O https://t.co/gI0rOI9hfY
@Nattackera Jag tycker du är en fin dam som kör bil som en galning. Jävligt rolig är du åxå när vi varit iväg. Du ä https://t.co/KzIPNu0Jo2,mattiastjakt,1280489766,sv,@Nattackera I think you are a nice lady who drives a car like a madman. Damn funny you are too when we left. You are https://t.co/KzIPNu0Jo2
Min fru är inte bara min stora kärlek hon är även min bästa vän. Har så sjukt kul ihop med henne  #livet #bästafrun,mattiastjakt,1280489766,sv,My wife is not only my great love she is also my best friend. Have so sick fun with her # life # best wife
"RT @ABDebatt: Vad är det för formel SD använder för att locka folk? Den är lätt att känna igen. Populister, fascister, demagoger och antide",mattiastjakt,1280489766,sv,"RT @ABDebatt: What kind of formula does SD use to attract people? It is easy to recognize. Populists, fascists, demagogues and antides"
Det är familjen som håller mig vid liv. #kärlek #livet #minunderbarafruochbarn,mattiastjakt,1280489766,sv,It&#39;s the family that keeps me alive. # love # life #missable wife and child
