text,name,id,lang,translated
"Julkalendern 2019  Lucka 14

Bakom dagens lucka hittar vi ett passande pris för denna mörka årstid - en fickla https://t.co/hkHq6tQy51",IFKGoteborg,386122101,sv,Christmas Calendar 2019 Door 14 Behind today&#39;s door we find a suitable price for this dark season - a flashlight https://t.co/hkHq6tQy51
"Stolthet. Lojalitet. Abstinens. Tillsammans.
Med ett årskort får du allt det  och mycket mer.

 Här är Sebastian https://t.co/z1eUXgPd99",IFKGoteborg,386122101,sv,Pride. Loyalty. Withdrawal. Together. With a year pass you get all that and much more. Here is Sebastian https://t.co/z1eUXgPd99
" Trenden är tydlig.
 
Många är snabba med att förnya sina årskort och många köper nytt. 

Lägesuppdatering om års https://t.co/znxtCZgzDC",IFKGoteborg,386122101,sv,The trend is clear. Many are quick to renew their annual cards and many are buying new ones. Location update about this year&#39;s https://t.co/znxtCZgzDC
" R S K O R T 2020

Vi ses på Gamla Ullevi nästa år 
https://t.co/kgU0DMOE5M | #ifkgbg https://t.co/AIuqyoLCZq",IFKGoteborg,386122101,sv,RSCARD 2020 See you at Old Ullevi next year https://t.co/kgU0DMOE5M | #ifkgbg https://t.co/AIuqyoLCZq
"Julkalendern 2019  Lucka 13

 I dag kan årskortsinnehavare 2020 tävla om en övernattning på Sveriges första f https://t.co/xjFPq2Cfsf",IFKGoteborg,386122101,sv,"Christmas calendar 2019 Lucky 13 Today, year-card holders 2020 can compete for an overnight stay in Sweden&#39;s first f https://t.co/xjFPq2Cfsf"
"Eufori. Kämparglöd. Underlägen. verläge. 
Med ett årskort får du allt det  och mycket mer.

 Här är Alf Westerbe https://t.co/EuHN2cnLfi",IFKGoteborg,386122101,sv,Euphoria. Fighting spirit. During modes. Verlage. With a year pass you get all that and much more. Here is Alf Westerbe https://t.co/EuHN2cnLfi
"Akademilagen vidare i ligacupen 

9 Matcher
9 Vinster
45 Gjorda mål

 Avancemang för P19, P17 och P16.

 https://t.co/IUka9KKIan",IFKGoteborg,386122101,sv,"Academy team further in the league cup 9 Matches 9 Wins 45 Goal goals Advanced for P19, P17 and P16. https://t.co/IUka9KKIan"
"Lista: Vinnarna i årets julkalender 
https://t.co/JvaNS86fUV | #ifkgbg

Artikeln uppdateras med nya vinnare för va https://t.co/hKCiwzRI4R",IFKGoteborg,386122101,sv,List: The winners of this year&#39;s Christmas calendar https://t.co/JvaNS86fUV | #ifkgbg Article updated with new winners for our https://t.co/hKCiwzRI4R
"Du har väl löst årets julklapp? 

Om inte så kommer länken här 
https://t.co/kgU0DN6eXk | #ifkgbg 

Vi ses på Gam https://t.co/N0E3kXNynu",IFKGoteborg,386122101,sv,"You&#39;ve solved this year&#39;s Christmas present, right? If not, the link here will be https://t.co/kgU0DN6eXk | #ifkgbg See you at Gam https://t.co/N0E3kXNynu"
"Tänd de blåvita drömmarna i jul. 

 Barnboken Blåvita Drömmar har skapats för framtidens supportrar. 

Du hittar https://t.co/RNfjeINNrg",IFKGoteborg,386122101,sv,Light the blue and white dreams in Christmas. The children&#39;s book Blue and White Dreams has been created for the future&#39;s supporters. You can find https://t.co/RNfjeINNrg
"Julkalendern 2019  Lucka 12

 Bakom dagens lucka finns en komplett låssats från YaleDoorman från vår partner https://t.co/fQh3na8KKO",IFKGoteborg,386122101,sv,Christmas Calendar 2019 Door 12 Behind today&#39;s door is a complete lock kit from YaleDoorman from our partner https://t.co/fQh3na8KKO
"Vi. Dem. Lycka. Tur. Otur. Tre poäng.
Med ett årskort får du allt det  och mycket mer.

 Här är analytikern https://t.co/tQw6d5EYHY",IFKGoteborg,386122101,sv,We. Them. Happiness. Lucky. Bad luck. Three points. With a year pass you get all that and much more. Here is the analyst https://t.co/tQw6d5EYHY
" Vi firar den färska landslagsplatsen med Robin Söders 14 mål från @AllsvenskanSE i år!

Vilket är ditt favoritmål https://t.co/NODCwSoo6q",IFKGoteborg,386122101,sv,We are celebrating the fresh national team with Robin Söder&#39;s 14 goals from @AllsvenskanSE this year! Which is your favorite destination https://t.co/NODCwSoo6q
"Blåvittrio till A-landslaget 

Stort grattis säger vi till:
 Robin Söder
 August Erlingmark
 Kristopher Da Gra https://t.co/8J0j7lozId",IFKGoteborg,386122101,sv,Blue-white trio to the A-national team Big congratulations to: Robin Söder August Erlingmark Kristopher Da Gra https://t.co/8J0j7lozId
"Veckans julklapp 

20% rabatt på IFK-posters  erbjudandet gäller veckan ut 
https://t.co/Gr4VDA0xJx | #ifkgbg https://t.co/2CbaYVkoYe",IFKGoteborg,386122101,sv,This week&#39;s Christmas gift 20% discount on the IFK poster&#39;s offer is valid for the week out https://t.co/Gr4VDA0xJx | #ifkgbg https://t.co/2CbaYVkoYe
" Filminspelning idag 

Kom till Gamla Ullevi idag måndag klockan 16.30 och hjälp oss med vår filminspelning. Vi s https://t.co/dCwF5FLoyx",IFKGoteborg,386122101,sv,Movie recording today Come to Old Ullevi today Monday at 4.30 pm and help us with our movie recording. We s https://t.co/dCwF5FLoyx
"RT @SLO_IFKGoteborg: Ikväll är det ringkampanj på Kamratgården.
Hjälp till att fylla Gamla Ullevi.
Vi ses ikväll kamrater. #ifkgbg https://",IFKGoteborg,386122101,sv,RT @SLO_IFKGoteborg: Tonight it&#39;s ring campaign at Kamratgården. Help fill Old Ullevi. We&#39;ll see you guys tonight. #ifkgbg https: //
"Julkalendern 2019  Lucka 11

 Efter en härlig, mysig, men också lite stressig jul, kommer dagens lucka väl ti https://t.co/vCLxL1d5eG",IFKGoteborg,386122101,sv,"The Christmas calendar 2019 Door 11 After a lovely, cozy, but also a little stressful Christmas, today&#39;s door will come well at https://t.co/vCLxL1d5eG"
Tobias Hysn går vidare. #ifkgbg https://t.co/X9Fl2Pk3ZT https://t.co/308HhIYIb7,IFKGoteborg,386122101,sv,Tobias Hysn goes on. #ifkgbg https://t.co/X9Fl2Pk3ZT https://t.co/308HhIYIb7
"Förväntan. Förtvivlan. Glädje. verraskningar.
Med ett årskort får du allt det  och mycket mer.

 Här är https://t.co/xCHLbQsWhX",IFKGoteborg,386122101,sv,Anticipation. Despair. Joy. surprises. With a year pass you get all that and much more. Here is https://t.co/xCHLbQsWhX
"Trevlig andra advent kamrater 

Julens färger går i blått och vitt! Visa hur du firar din  jul genom att tagga https://t.co/5kunF2ly1o",IFKGoteborg,386122101,sv,Nice other advent buddies Christmas colors go in blue and white! Show how to celebrate your Christmas by tagging https://t.co/5kunF2ly1o
"RT @IFKGoteborg:  Vill du bli blåvit filmstjärna?

Kom till Gamla Ullevi på måndag klockan 16.30. Vi samlas vid Gunnar Gren-statyn. Klä di",IFKGoteborg,386122101,sv,RT @IFKGoteborg: Do you want to become a blue and white movie star? Come to Old Ullevi on Monday at 16.30. We gather at the Gunnar Gren statue. Get dressed
"Julkalendern 2019 Lucka 

 Dagens lyckliga vinnare får låna en ny Passat Sportcombi från vår partner Volkswagen https://t.co/CXtig3TYMn",IFKGoteborg,386122101,sv,Christmas Calendar 2019 Happiness Today&#39;s lucky winners may borrow a new Passat Sportcombi from our partner Volkswagen https://t.co/CXtig3TYMn
"Kamratskap. Segrar. Bakslag. Vinnarlag.
Med ett årskort får du allt det  och mycket mer.

 Här är @Sana_Tobias st https://t.co/sSb1CAsBy4",IFKGoteborg,386122101,sv,Fellowship. Victories. Setback. Winning team. With a year pass you get all that and much more. Here&#39;s @Sana_Tobia&#39;s https://t.co/sSb1CAsBy4
"Härliga rabatter från vår partner Nordic Wellness fram till julafton 

Ta del av flera generösa erbjudanden  https://t.co/1d1hv0R5TY",IFKGoteborg,386122101,sv,Great discounts from our partner Nordic Wellness until Christmas Eve Take part in several generous offers https://t.co/1d1hv0R5TY
"I slutet av januari öppnar Blåvittshopen 2.0!

Vi har öppet fram till 28 december innan renoveringen inleds. Passa https://t.co/zKRRr2yXXA",IFKGoteborg,386122101,sv,"At the end of January, Blåvittshopen 2.0 opens! We are open until December 28 before the renovation begins. Pass https://t.co/zKRRr2yXXA"
"Julkalendern 2019  Lucka 9

 Lagom till julens alla matinköp kommer här en passande lucka  presentkort på 1000 https://t.co/FqOLPtTfx0",IFKGoteborg,386122101,sv,"Christmas calendar 2019 Door 9 In addition to all Christmas food purchases, here comes a suitable door gift card at 1000 https://t.co/FqOLPtTfx0"
"Mål. Vrål. Glädje. Ilska. Gemenskap.

 Här är SLO Christopher Lindahls starkaste minne från i år.

2020 skapar vi https://t.co/s4SwyyKwrP",IFKGoteborg,386122101,sv,"Goal. Roar. Joy. Anger. Community. Here is SLO Christopher Lindahl&#39;s strongest memory from this year. By 2020, we are creating https://t.co/s4SwyyKwrP"
"Nytt julrim till årets absolut bästa julklapp 

rskortet hittar du här  https://t.co/kgU0DMOE5M | #ifkgbg https://t.co/5chD0rlC1H",IFKGoteborg,386122101,sv,New Christmas rhyme for this year&#39;s absolute best Christmas gift card can be found here https://t.co/kgU0DMOE5M | #ifkgbg https://t.co/5chD0rlC1H
" Varmt välkommen till IFK Göteborgs årliga julmarknad i Nordstan lördagen 21 december kl. 10-18.

Läs mer  https://t.co/BZWCEJNH4S",IFKGoteborg,386122101,sv,Warm welcome to IFK Gothenburg&#39;s annual Christmas market in Nordstan on Saturday 21 December at. 10-18. Read more https://t.co/BZWCEJNH4S
" Vill du bli blåvit filmstjärna?

Kom till Gamla Ullevi på måndag klockan 16.30. Vi samlas vid Gunnar Gren-statyn. https://t.co/MmgIfzEdTr",IFKGoteborg,386122101,sv,Want to become a blue and white movie star? Come to Old Ullevi on Monday at 16.30. We gather at the Gunnar Gren statue. https://t.co/MmgIfzEdTr
"Nu släpps jultröjan!

 Begränsat antal  först till kvarn gäller.

Här köper du tröjan 
https://t.co/W58to1GINt | https://t.co/5cVgaq4uVo",IFKGoteborg,386122101,sv,"Now the Christmas sweater is released! Limited number first come, first served. Here you buy the shirt https://t.co/W58to1GINt | https://t.co/5cVgaq4uVo"
"Julkalendern 2019  Lucka 8

 Vad sägs om en vistelse för två på fantastiska Stenungsbaden?

Som årskortsinnehav https://t.co/gI5JxIuDPZ",IFKGoteborg,386122101,sv,Christmas calendar 2019 Lucka 8 How about a stay for two at the fantastic Stenungsbaden? As a year-end holding https://t.co/gI5JxIuDPZ
Julstädning på Kamratgården  #ifkgbg https://t.co/M8RmmEBcAF,IFKGoteborg,386122101,sv,Christmas cleaning at Kamratgården #ifkgbg https://t.co/M8RmmEBcAF
Unga Blåvittspelare till landslaget. #ifkgbg https://t.co/WDAvGLI9ZL,IFKGoteborg,386122101,sv,Young Blue White players to the national team. #ifkgbg https://t.co/WDAvGLI9ZL
"Passion. Hjärta. Medgång. Nedgång. Smärta. Glädje. Eufori.

 Här är Pakas starkaste minne från i år.

2020 skapar https://t.co/S1rxiTHtL8",IFKGoteborg,386122101,sv,Passion. Heart. Prosperity. Decline. Pain. Joy. Euphoria. Here is Paka&#39;s strongest memory from this year. 2020 creates https://t.co/S1rxiTHtL8
På kvällens glöggmingel för årskortsinnehavare är det 50% rabatt på alla Kappa-produkter (ej matchtröjor) och 30% https://t.co/vMCPn1wEAm,IFKGoteborg,386122101,sv,"Tonight&#39;s mulled wine for year-round holders, there is a 50% discount on all Kappa products (not match shirts) and 30% https://t.co/vMCPn1wEAm"
@nickep85 Hej! Det går jättebra att förnya årskortet på plats ikväll! #ifkgbg,IFKGoteborg,386122101,sv,@ nickep85 Hello! It is great to renew the annual card in place tonight! #ifkgbg
" Blåvittshopen bjuder in till glöggmingel

Klockan 18-20 är alla årskortsinnehavare varmt välkomna till shopen vid https://t.co/DdYmgj1iSk",IFKGoteborg,386122101,sv,"Blåvittshopen invites to glöggmingel At 18-20, all year card holders are warmly welcomed to the shop at https://t.co/DdYmgj1iSk"
"Julkalendern 2019  Lucka 7

 I dagens prispott finns två träningskort hos Nordic Wellness  det optimala st https://t.co/79QfIwnGeb",IFKGoteborg,386122101,sv,Christmas calendar 2019 Lucky 7 In today&#39;s prize pool there are two training cards at Nordic Wellness the optimal st https://t.co/79QfIwnGeb
" Missa inte!

Om du köper årskort på Kommandobryggan eller Bebbens Hylla senast 31 december får du 200 kronor i E https://t.co/OgCqMMQTVM",IFKGoteborg,386122101,sv,"Do not miss! If you buy annual tickets at the Command Bridge or Bebbens Shelf by December 31, you will receive SEK 200 in E https://t.co/OgCqMMQTVM"
Det kommer in många frågor om vart vinnarna presenteras. Inom de närmsta dagarna kommer vi att offentliggöra alla v https://t.co/efr2b5iCLo,IFKGoteborg,386122101,sv,There are many questions about where the winners are presented. Within the next few days we will publish all v https://t.co/efr2b5iCLo
"Julkalendern 2019 Lucka 6

 Dagens lucka är perfekt för dig som går i renoveringstankar  elinstallationer/mat https://t.co/aaI9aGg8f6",IFKGoteborg,386122101,sv,Christmas Calendar 2019 Door 6 Today&#39;s door is perfect for those who go into renovation tanks electrical installations / food https://t.co/aaI9aGg8f6
" Alhassan Yusuf

Vilket första år det blev i @AllsvenskanSE 
 26 matcher
 2 mål
 2 assist
 Utsedd till ret https://t.co/BGz7pK7aXi",IFKGoteborg,386122101,sv,Alhassan Yusuf What a first year it was in @AllsvenskanSE 26 games 2 goals 2 assists Appointed to ret https://t.co/BGz7pK7aXi
Hemmaplan spikad för cupen.  https://t.co/K5MwbgLLhm #allatillvalhalla #ifkgbg https://t.co/4k5nnICm6C,IFKGoteborg,386122101,sv,Home plan nailed for the cup. https://t.co/K5MwbgLLhm #allatillvalhalla #ifkgbg https://t.co/4k5nnICm6C
"Julkalendern 2019  Lucka 5

 Det finns knappt något som är bättre än en härlig, lång hotellfrukost.

Idag kan d https://t.co/igCD7cJUEU",IFKGoteborg,386122101,sv,"Christmas Calendar 2019 Lucky 5 There is hardly anything better than a lovely, long hotel breakfast. Today, d https://t.co/igCD7cJUEU"
"Match efter match står de där. De ovärdeliga volontärerna som gör arrangemangen möjliga

I år genomförde https://t.co/p8OurYyPhF",IFKGoteborg,386122101,sv,"Match after match they stand there. The invaluable volunteers who make the events possible This year, https://t.co/p8OurYyPhF"
"Bara tre veckor kvar till julafton...

nnu inte löst julklapp? Då är denna länk perfekt för dig
 https://t.co/QPeoHvffum",IFKGoteborg,386122101,sv,Only three weeks left for Christmas Eve ... not yet solved Christmas present? Then this link is perfect for you https://t.co/QPeoHvffum
"Veckans julklapp 

Rabatt på Blåvittshopens armbandsur erbjudandet gäller veckan ut 
https://t.co/AofFzTSQjz https://t.co/67u9L6s4zH",IFKGoteborg,386122101,sv,This week&#39;s Christmas gift Discount on the Blåvittshopens wristwatch offer is valid for the week out https://t.co/AofFzTSQjz https://t.co/67u9L6s4zH
@linkan80gbg Såvitt vi förstår är hon inte aktuell för IFK.,DamGoteborg,1204127593437519874,sv,"@ linkan80gbg As far as we understand, she is not relevant to IFK."
Spännande! Vad tror vi om detta? #ifkgbg https://t.co/P525Os2DmS,DamGoteborg,1204127593437519874,sv,Exciting! What do we think about this? #ifkgbg https://t.co/P525Os2DmS
@mickefalis @kenflagio Vi förstår att vissa tycker det är intressant att veta vilka som står bakom kontot men nu i https://t.co/ihpGYplbmh,DamGoteborg,1204127593437519874,sv,@mickefalis @kenflagio We understand that some people find it interesting to know who is behind the account but now in https://t.co/ihpGYplbmh
Så att inte förvirring ska uppstå. Detta är alltså INTE ett officiellt konto för Blåvitts damlag. Det drivs av supp https://t.co/9gwuia8KYc,DamGoteborg,1204127593437519874,sv,So that no confusion should arise. This is NOT an official account for Blåvit&#39;s women&#39;s team. It is run by supp https://t.co/9gwuia8KYc
@joakim_gbg Inte ännu. Vi börjar på Twitter så ser vi var det landar. Det här är inget officiellt konto utan ett in https://t.co/zy0L2QcwsD,DamGoteborg,1204127593437519874,sv,@joakim_gbg Not yet. We start on Twitter so we see where it lands. This is not an official account but an https://t.co/zy0L2QcwsD entry
"@Axelhurtig12 Spelarpresentationer finns på agendan och det hoppas vi lösa, men det är tidigt i projektet och det f https://t.co/NeuKZkTd83",DamGoteborg,1204127593437519874,sv,"@ Axelhurtig12 Player presentations are on the agenda and we hope to resolve, but it is early in the project and it is https://t.co/NeuKZkTd83"
RT @RudyAlvarado: @uffefransson @ckjonsson @DamGoteborg Herr ordförande berättade att F15-laget skall utgöra stommen i damlaget.,DamGoteborg,1204127593437519874,sv,RT @RudyAlvarado: @uffefransson @ckjonsson @DamGoteborg Mr. Chairman told that the F15 team should be the body of the women&#39;s team.
Vi närmar oss 1000 följare bara elva timmar efter att vi startat kontot. Kul att se!,DamGoteborg,1204127593437519874,sv,We are approaching 1000 followers just eleven hours after we started the account. Fun to see!
@jensalmgren @tjurhenke Vad tror du om bindestrecket?,DamGoteborg,1204127593437519874,sv,@jensalmgren @tjurhenke What do you think about the dash?
@jensalmgren @tjurhenke Fast då kan man tro att det bara är tjejer som är supportrar ;),DamGoteborg,1204127593437519874,sv,@jensalmgren @tjurhenke Although then you can think that only girls are supporters;)
@jensalmgren @tjurhenke Men tack för anmärkningen!,DamGoteborg,1204127593437519874,sv,@jensalmgren @tjurhenke But thanks for the comment!
@jensalmgren @tjurhenke Det var ingen särskrivning egentligen men vi har lagt till en versal i Dam. Kontot drivs av https://t.co/F9WIt7NRaa,DamGoteborg,1204127593437519874,sv,@jensalmgren @tjurhenke There was no description really but we have added a capital letter in Dam. The account is operated by https://t.co/F9WIt7NRaa
RT @NiclasAlex: Merparten av tjejerna i laget följer jag dagligen på nglagårdsskolan. Nu också på twitter! @DamGoteborg https://t.co/nGEI9,DamGoteborg,1204127593437519874,sv,RT @NiclasAlex: Most of the girls in the team I follow daily at nglagårds school. Now also on twitter! @DamGoteborg https://t.co/nGEI9
RT @RudyAlvarado: Idag spelade det som skall bli IFK Göteborgs damlag (@DamGoteborg) en träningsmatch mot IK Zenith. Rapporterna säger att,DamGoteborg,1204127593437519874,sv,"RT @RudyAlvarado: Today, what will become IFK Gothenburg&#39;s women&#39;s team (@DamGoteborg) played a training match against IK Zenith. The reports say that"
@den_blavite @gbgolsson Vi räknar med att det kommer ett officiellt konto inom kort men tills vidare tänker vi köra https://t.co/rQDXJMGk2t,DamGoteborg,1204127593437519874,sv,@den_blavite @gbgolsson We expect there will be an official account soon but for now we plan to run https://t.co/rQDXJMGk2t
@GPSporten @GTnyheter https://t.co/FgP85LkhRX,DamGoteborg,1204127593437519874,und,@GPSporten @GTnyheter https://t.co/FgP85LkhRX
@barabenpaglenn @BBPatrik @BBJocke @hysentobias @rasmusifk @NiclasAlex @Kennet19Kennet,DamGoteborg,1204127593437519874,und,@barabenpaglenn @BBPatrik @BBJocke @hysentobias @rasmusifk @NiclasAlex @ Kennet19Kennet
RT @Snickarnspojk: Den som inte följer är gajsare! https://t.co/eho9y1XzOu,DamGoteborg,1204127593437519874,sv,RT @Snickarnspojk: Whoever does not follow is Gaiser! https://t.co/eho9y1XzOu
RT @ThaiOseTrab: In och följ #ifkgbg https://t.co/kKFyFJZ4GS,DamGoteborg,1204127593437519874,sv,RT @ThaiOseTrab: Enter and follow #ifkgbg https://t.co/kKFyFJZ4GS
@barabenpaglenn @BBPatrik @BBJocke @hysentobias @rasmusifk,DamGoteborg,1204127593437519874,und,@barabenpaglenn @BBPatrik @BBJocke @hysentobias @rasmusifk
@barabenpaglenn @BBPatrik @BBJocke,DamGoteborg,1204127593437519874,und,@barabenpaglenn @BBPatrik @BBJocke
@barabenpaglenn,DamGoteborg,1204127593437519874,und,@barabenpaglenn
@EgonLjung Tack Egon!,DamGoteborg,1204127593437519874,sv,@EgonLjung Thanks Egon!
@den_blavite @gbgolsson Om du har ett bra förslag så skjut ,DamGoteborg,1204127593437519874,sv,@den_blavite @gbgolsson If you have a good suggestion then shoot
Malmö FF:s konto för damlaget ligger just nu på knappt 2100 följare. Om alla våra supportrar kan ställa sig bakom B https://t.co/5GxEX8957S,DamGoteborg,1204127593437519874,sv,Malmö FF&#39;s account for the women&#39;s team currently stands at just under 2100 followers. If all our supporters can support B https://t.co/5GxEX8957S
Vi ska vara fler och sjunga mer än is i division 4 nästa säsong. Då behöver alla kamrater sluta upp för tjejerna. https://t.co/nTYI6wx6IT,DamGoteborg,1204127593437519874,sv,We should be more and sing more than ice in Division 4 next season. Then all the friends need to end up for the girls. https://t.co/nTYI6wx6IT
Vi har funnits i knappt en timme och vi har redan börjat närma oss 200 följare. Kom igen kamrater! Detta blir en spännande resa. #ifkgbg,DamGoteborg,1204127593437519874,sv,"We have been around for almost an hour and we have already started approaching 200 followers. Come on, comrades! This will be an exciting journey. #ifkgbg"
Vi kommer följa IFK Göteborgs resa från Division 4 mot Damallsvenskan. Förhoppningsvis kommer vi kunna lägga upp ma https://t.co/OORLeAORsl,DamGoteborg,1204127593437519874,sv,We will follow IFK Gothenburg&#39;s journey from Division 4 towards Damallsvenskan. Hopefully we will be able to post ma https://t.co/OORLeAORsl
#ifkgbg,DamGoteborg,1204127593437519874,und,#ifkgbg
"IFK Göteborgs damer har också ett Twitter-konto. Följ nu, så slår vi Malmö FF!",DamGoteborg,1204127593437519874,sv,"IFK Gothenburg ladies also have a Twitter account. Follow now, and we&#39;ll beat Malmö FF!"
@sedetpositivt Jo men i en shop så kan det ju få vara lite fokus på vår historia. Som sagt jag hade klippt till direkt .,Andreas48396476,981890801398616064,sv,"@sedetpositivt Yes but in a shop it may be a little focus on our history. As I said, I had the cut right away."
@A11Hson Nej så är det ju men vi hade ju Adidas väldigt länge som borde kunna lösa det.,Andreas48396476,981890801398616064,sv,"@ A11Hson No it is, but we had Adidas for a very long time that should be able to solve it."
Med vår historia. Varför görs det inte snygga retromatchtröjor i shoppen? Tänk tajta 80 tals tröjor? Med det gamla https://t.co/m3kl7EIHql,Andreas48396476,981890801398616064,sv,With our history. Why not get some good retro sweatshirts in the shop? Think tight 80&#39;s shirts? With the old https://t.co/m3kl7EIHql
@MarkusWulcan Ok. Tänker att Giorgi lär lämna till sommaren så men då kanske en mer etablerad ersättare tas in.,Andreas48396476,981890801398616064,sv,"@MarkusWulcan Ok. Thinking that Giorgi will be leaving for the summer, but then a more established replacement might be included."
"@MarkusWulcan Av spelare i u lag som tagit steg eller Hasse, Agge, sebban, Adil, toko? För det sistnämnda visste man ju redan tänker jag.",Andreas48396476,981890801398616064,sv,"@MarkusWulcan By players iu teams who have taken steps or Hasse, Agge, sebban, Adil, toko? For the latter you already knew, I think."
@MarkusWulcan Före i kön? Internt eller externt?,Andreas48396476,981890801398616064,sv,@MarkusWulcan Before in the queue? Internally or externally?
"Da Graca, Söder och Erlingmark i Januariturnen. Hand upp alla som trodde det för 10 månader sen?",Andreas48396476,981890801398616064,sv,"Da Graca, Söder and Erlingmark in the January tour. Hand up anyone who thought it 10 months ago?"
@DaVukovic Om giorgi säljs kanske Aiesh kan ta platsen till vänster och dmk till höger. Viktigt med speed på kanter https://t.co/UqacfMMVdJ,Andreas48396476,981890801398616064,sv,@DaVukovic If giorgi is sold maybe Aiesh can take the place on the left and dmk on the right. Important with speed on edges https://t.co/UqacfMMVdJ
@bergmanAlle @A11Hson @ShopenBlavitt @IFKGoteborg Var helt slut i somras med.,Andreas48396476,981890801398616064,sv,@bergmanAll @ A11Hson @ShopenBlavitt @IFKGoteborg Was completely over this summer with.
@uefaranken Dock vann väl Hamburg Europacupen året efter dom fick stryk av Blåvitt i Uefacupen 82?,Andreas48396476,981890801398616064,sv,@uefaranken Dock well won the Hamburg European Cup the year after they got beat by Blåvitt in Uefacupen 82?
@DaVukovic Den enda positionen som inte känns klockren är Farnerud. Framförallt då vi inte haft någon framgångsrik https://t.co/5TyDTbdL2Y,Andreas48396476,981890801398616064,sv,@DaVukovic The only position that doesn&#39;t feel right is Farnerud. Especially since we had no successful https://t.co/5TyDTbdL2Y
@Hulkenmini Och näst sista en hemmaförlust,Andreas48396476,981890801398616064,sv,@Hulkenmini And next to last a home loss
@Hulkenmini Nej jag menade inte byta plats utan ta ytterligare steg som i utvecklas. Amin ska säljas efter försäsongen. Där är han kung.,Andreas48396476,981890801398616064,sv,@Hulkenmini No I didn&#39;t mean to change place but take further steps as in development. Amin will be sold after the preseason. There he is king.
@Hulkenmini Hade gärna haft ett år till på /Holm. Gör han succ i vår måste vi förlänga till sommaren. Annars sitte https://t.co/VwYL2rKh0d,Andreas48396476,981890801398616064,sv,"@Hulkenmini Would have liked another year at / Holm. If he makes a success this spring, we must extend to the summer. Otherwise sit https://t.co/VwYL2rKh0d"
"@BirroMarcus Glöm inte Sebastian Eriksson, alltid längst fram på barrikaden.",Andreas48396476,981890801398616064,sv,"@BirroMarcus Don&#39;t forget Sebastian Eriksson, always at the front of the barricade."
@konradhatte @AndreasPersson0 @erikssonhenrik ...hans enorma betydelse för MFF är förnekelse. Rosenberg har gjort m https://t.co/nmYn1yEn3Z,Andreas48396476,981890801398616064,sv,@konradhatte @ AndreasPersson0 @erikssonhenrik ... his tremendous importance for MFF is denial. Rosenberg has done m https://t.co/nmYn1yEn3Z
"@konradhatte @AndreasPersson0 @erikssonhenrik Fick avkastning på pengarna genom att kunna köpa ihop ett bra lag, vä https://t.co/j2b6sksKd9",Andreas48396476,981890801398616064,sv,"@konradhatte @ AndreasPersson0 @erikssonhenrik Earned money by buying a good team, please https://t.co/j2b6sksKd9"
